{
  "schema_version": "0.2",
  "plan_id": "flowgate-v1-golden",
  "prd": {
    "path": "sdet/fixtures/flowgate_prd.md",
    "sha256": "1dd5512ad78babab793632f8a53517d55bde8fd625883813b5ad9987ce7352c2"
  },
  "sut": {
    "name": "flowgate",
    "base_urls": {
      "live": "https://flowgate-pramathesh.fly.dev",
      "local": "http://localhost:8080"
    }
  },
  "generator": {
    "kind": "human",
    "generated_at": "2026-09-21T00:00:00-07:00"
  },
  "requirements": [
    {
      "id": "REQ-HLT-001",
      "source_quote": "GET /healthz returns 200 with body \"ok\".",
      "summary": "Health endpoint returns 200 ok",
      "kind": "functional",
      "testable": true
    },
    {
      "id": "REQ-ORD-001",
      "source_quote": "Requests to /work pass through the checks in this order: load shedding, then rate limiting, then the circuit breaker, then the backend.",
      "summary": "Protection chain order is shed, rate-limit, breaker, backend",
      "kind": "functional",
      "testable": false,
      "untestable_reason": "Order is only observable black-box when two checks would reject the same request at the same moment; not reliably reproducible against a live service. Belongs in an in-process middleware test."
    },
    {
      "id": "REQ-SHD-001",
      "source_quote": "When 50 requests are already in flight, additional requests are rejected immediately with 503 and body \"server overloaded, try again shortly\".",
      "summary": "Over 50 in-flight requests are shed with 503 and a specific body",
      "kind": "functional",
      "testable": true
    },
    {
      "id": "REQ-SHD-002",
      "source_quote": "Requests are never queued.",
      "summary": "Shed requests are rejected without waiting",
      "kind": "nonfunctional",
      "testable": true
    },
    {
      "id": "REQ-RL-001",
      "source_quote": "Each client is limited to 5 requests per second sustained, with a burst of 20.",
      "summary": "Token bucket: 5 req/s sustained, burst 20, per client",
      "kind": "functional",
      "testable": true
    },
    {
      "id": "REQ-RL-002",
      "source_quote": "A client is identified by the Fly-Client-IP header when present, otherwise by the IP address of the connection, ignoring the port.",
      "summary": "Client identity is Fly-Client-IP, else connection IP without port",
      "kind": "functional",
      "testable": true
    },
    {
      "id": "REQ-RL-003",
      "source_quote": "Over-limit requests are rejected with 429, body \"rate limit exceeded\", and a Retry-After header of at least 1 second.",
      "summary": "429 response shape: body text and Retry-After >= 1",
      "kind": "functional",
      "testable": true
    },
    {
      "id": "REQ-CB-001",
      "source_quote": "After 5 backend failures the breaker opens.",
      "summary": "Breaker opens after 5 backend failures",
      "kind": "functional",
      "testable": true
    },
    {
      "id": "REQ-CB-002",
      "source_quote": "While open, requests are rejected with 503 and body \"backend unavailable\".",
      "summary": "Open breaker rejects with 503 backend unavailable",
      "kind": "functional",
      "testable": true
    },
    {
      "id": "REQ-CB-003",
      "source_quote": "After a 10 second cooldown the breaker allows a trial request; success closes it, failure reopens it.",
      "summary": "Half-open trial after 10s cooldown",
      "kind": "functional",
      "testable": true
    },
    {
      "id": "REQ-BE-001",
      "source_quote": "About 2% of requests fail with 500.",
      "summary": "Simulated backend error rate about 2%",
      "kind": "nonfunctional",
      "testable": true
    },
    {
      "id": "REQ-MET-001",
      "source_quote": "/metrics reports flowgate_requests_total with an outcome label (allowed, error, shed, rate_limited, breaker_open), flowgate_breaker_state, and flowgate_in_flight_requests.",
      "summary": "Metrics endpoint exposes the three named series",
      "kind": "functional",
      "testable": true
    },
    {
      "id": "REQ-SLO-001",
      "source_quote": "p95 latency of /work at or below 150 ms under about 2,000 requests per second sustained.",
      "summary": "p95 <= 150ms at ~2,000 req/s",
      "kind": "slo",
      "testable": true
    },
    {
      "id": "REQ-SLO-002",
      "source_quote": "Backend success rate of at least 95% for admitted requests.",
      "summary": "Admitted-request success rate >= 95%",
      "kind": "slo",
      "testable": true
    }
  ],
  "test_cases": [
    {
      "id": "TC-001",
      "title": "Health endpoint returns 200 ok",
      "requirement_ids": [
        "REQ-HLT-001"
      ],
      "category": "functional",
      "priority": "P1",
      "environment": "any",
      "determinism": "deterministic",
      "steps": [
        {
          "kind": "request",
          "description": "Call /healthz once",
          "request": {
            "method": "GET",
            "path": "/healthz"
          }
        }
      ],
      "assertions": [
        {
          "subject": "status",
          "operator": "eq",
          "expected": 200,
          "description": "Healthy service returns 200"
        },
        {
          "subject": "body",
          "operator": "contains",
          "expected": "ok",
          "description": "Body is ok"
        }
      ],
      "tags": [
        "smoke"
      ]
    },
    {
      "id": "TC-002",
      "title": "Burst of 20 is admitted, requests beyond it are rate limited",
      "requirement_ids": [
        "REQ-RL-001"
      ],
      "category": "boundary",
      "priority": "P0",
      "environment": "any",
      "determinism": "deterministic",
      "preconditions": [
        "Exactly one gateway instance is serving this client (see Q-003)",
        "This client has sent no requests for at least 5 seconds, so its bucket is full"
      ],
      "steps": [
        {
          "kind": "request",
          "description": "Send 30 requests to /work at once from one client",
          "request": {
            "method": "GET",
            "path": "/work",
            "count": 30,
            "concurrency": 30
          }
        }
      ],
      "assertions": [
        {
          "subject": "count",
          "operator": "gte",
          "expected": 1,
          "filter": {
            "status": 429
          },
          "description": "At least one request beyond the burst is rejected"
        },
        {
          "subject": "count",
          "operator": "lte",
          "expected": 10,
          "filter": {
            "status": 429
          },
          "description": "No more than the 10 over-burst requests are rejected (refill during the send can only admit more)"
        }
      ],
      "tags": [
        "rate-limit"
      ]
    },
    {
      "id": "TC-003",
      "title": "429 response carries the documented body and Retry-After",
      "requirement_ids": [
        "REQ-RL-003"
      ],
      "category": "negative",
      "priority": "P1",
      "environment": "any",
      "determinism": "deterministic",
      "preconditions": [
        "Exactly one gateway instance is serving this client (see Q-003)"
      ],
      "steps": [
        {
          "kind": "request",
          "description": "Drain the bucket with 25 concurrent requests",
          "request": {
            "method": "GET",
            "path": "/work",
            "count": 25,
            "concurrency": 25
          }
        },
        {
          "kind": "request",
          "description": "Immediately send one more request, which must be over limit",
          "request": {
            "method": "GET",
            "path": "/work"
          }
        }
      ],
      "assertions": [
        {
          "subject": "status",
          "operator": "eq",
          "expected": 429,
          "description": "Over-limit request is rejected"
        },
        {
          "subject": "body",
          "operator": "contains",
          "expected": "rate limit exceeded",
          "description": "Documented body text"
        },
        {
          "subject": "header:Retry-After",
          "operator": "gte",
          "expected": 1,
          "description": "Retry-After is at least 1 second"
        }
      ],
      "tags": [
        "rate-limit"
      ]
    },
    {
      "id": "TC-004",
      "title": "Sustained traffic under 5 req/s is never limited",
      "requirement_ids": [
        "REQ-RL-001"
      ],
      "category": "boundary",
      "priority": "P1",
      "environment": "any",
      "determinism": "deterministic",
      "preconditions": [
        "Exactly one gateway instance is serving this client (see Q-003)"
      ],
      "steps": [
        {
          "kind": "request",
          "description": "Send 40 requests paced at 4 per second",
          "request": {
            "method": "GET",
            "path": "/work",
            "count": 40,
            "rate_per_s": 4
          }
        }
      ],
      "assertions": [
        {
          "subject": "count",
          "operator": "eq",
          "expected": 0,
          "filter": {
            "status": 429
          },
          "description": "Below the sustained rate, nothing is limited"
        }
      ],
      "tags": [
        "rate-limit"
      ]
    },
    {
      "id": "TC-005",
      "title": "Regression: separate connections from one IP share one bucket",
      "requirement_ids": [
        "REQ-RL-002",
        "REQ-RL-001"
      ],
      "category": "regression",
      "priority": "P0",
      "environment": "local",
      "determinism": "deterministic",
      "preconditions": [
        "Local instance, no Fly-Client-IP header, so identity falls back to the connection address",
        "This client's bucket is full"
      ],
      "steps": [
        {
          "kind": "request",
          "description": "Send 30 requests, each on a new TCP connection (new source port)",
          "request": {
            "method": "GET",
            "path": "/work",